{"checked_at":"2026-10-07T03:52:48.424Z","clock_assumption_refs":["CA-1"],"condition_results":[{"affected_by":[],"condition_id":"BR-RUA-010","evidence_refs":[{"artifact_path":"probe/journals/caller-journal.jsonl","artifact_sha256":"21d9ae742393fcac2e7f47925fb303a065125c7bcd0c2fbe5c8224bb2522ebe0","event_id":"234eb8a8-0c23-4a11-995f-baa3a806a59b"},{"artifact_path":"probe/journals/provider-journal.jsonl","artifact_sha256":"f081060c9dbec365a49f506c61ff913429b50cc1e4c1d4767eaa04b3b1744300","event_id":"5dd40566-7074-40d5-99c7-24668494a747"},{"artifact_path":"probe/journals/provider-journal.jsonl","artifact_sha256":"f081060c9dbec365a49f506c61ff913429b50cc1e4c1d4767eaa04b3b1744300","event_id":"9a4c48f1-7cc7-4b86-8a98-367af0d71669"}],"expected":{"clock_assumption_refs":["CA-1"],"ordering_basis":"cross_source_wall_clock","relation":"provider_commit_confirmed.committed_at < caller_timeout_recorded.timer_fired_at"},"indeterminate_reasons":[],"observed":{"caller_timeout_event_id":"234eb8a8-0c23-4a11-995f-baa3a806a59b","commit_event_id":"9a4c48f1-7cc7-4b86-8a98-367af0d71669","commit_requested_at":"2026-10-07T03:50:08.816Z","committed_at":"2026-10-07T03:50:08.875Z","confirmation_event_id":"5dd40566-7074-40d5-99c7-24668494a747","targeted_commit_count":1,"timer_fired_at":"2026-10-07T03:50:11.662Z","timer_minus_commit_requested_ms":"2846","timer_minus_committed_ms":"2787"},"result":"pass"},{"affected_by":[],"condition_id":"BR-RUA-011","evidence_refs":[{"artifact_path":"probe/journals/caller-journal.jsonl","artifact_sha256":"21d9ae742393fcac2e7f47925fb303a065125c7bcd0c2fbe5c8224bb2522ebe0"},{"artifact_path":"probe/journals/caller-journal.jsonl","artifact_sha256":"21d9ae742393fcac2e7f47925fb303a065125c7bcd0c2fbe5c8224bb2522ebe0","event_id":"1b5ee81c-35b7-4ca0-817f-d338b68c601f"},{"artifact_path":"probe/journals/caller-journal.jsonl","artifact_sha256":"21d9ae742393fcac2e7f47925fb303a065125c7bcd0c2fbe5c8224bb2522ebe0","event_id":"234eb8a8-0c23-4a11-995f-baa3a806a59b"},{"artifact_path":"probe/journals/caller-journal.jsonl","artifact_sha256":"21d9ae742393fcac2e7f47925fb303a065125c7bcd0c2fbe5c8224bb2522ebe0","event_id":"ac8cc6bd-14ee-4c40-8581-111a0ef3fbb2"}],"expected":{"abort_requested_at_not_after_recorded_at":true,"arbiter_winner":"TIMER","caused_by_dispatch":true,"elapsed_ns_at_least":"3000000000","outcome":"TIMED_OUT","transport_settled_at_claim":false},"indeterminate_reasons":[],"observed":{"abort_requested_at":"2026-10-07T03:50:11.663Z","arbiter_winner":"TIMER","caller_timeout_event_id":"234eb8a8-0c23-4a11-995f-baa3a806a59b","causation_event_ids":["ac8cc6bd-14ee-4c40-8581-111a0ef3fbb2"],"dispatch_event_id":"ac8cc6bd-14ee-4c40-8581-111a0ef3fbb2","elapsed_ns":"3002598931","monotonic_origin_event_id":"ac8cc6bd-14ee-4c40-8581-111a0ef3fbb2","outcome":"TIMED_OUT","recorded_at":"2026-10-07T03:50:11.663Z","transport_settled_at_claim":false},"result":"pass"},{"affected_by":[],"condition_id":"BR-RUA-012","evidence_refs":[{"artifact_path":"probe/journals/caller-journal.jsonl","artifact_sha256":"21d9ae742393fcac2e7f47925fb303a065125c7bcd0c2fbe5c8224bb2522ebe0","event_id":"234eb8a8-0c23-4a11-995f-baa3a806a59b"},{"artifact_path":"probe/journals/controller-journal.jsonl","artifact_sha256":"b12c4fd69de3344e66d5dc57aa0efa09cc0c034f3961bdf35eaff6a732b756c2","event_id":"0aac6fe4-d7a5-4e0f-abdb-232e184a6eca"},{"artifact_path":"probe/journals/provider-journal.jsonl","artifact_sha256":"f081060c9dbec365a49f506c61ff913429b50cc1e4c1d4767eaa04b3b1744300","event_id":"00d065fb-da90-4e9a-b057-808dba28fb6d"},{"artifact_path":"probe/journals/provider-journal.jsonl","artifact_sha256":"f081060c9dbec365a49f506c61ff913429b50cc1e4c1d4767eaa04b3b1744300","event_id":"5aae5616-e00c-454a-b9b5-4c1a23bef552"}],"expected":{"chain":"treatment_response_released -> treatment_timeout_observed -> timeout_signal_recorded -> caller_timeout_recorded","response_released":true,"timeout_observed":true},"indeterminate_reasons":[],"observed":{"caller_timeout_event_id":"234eb8a8-0c23-4a11-995f-baa3a806a59b","chain_resolves":true,"observation_event_id":"00d065fb-da90-4e9a-b057-808dba28fb6d","release_event_id":"5aae5616-e00c-454a-b9b5-4c1a23bef552","safety_release_count":0,"signal_event_id":"0aac6fe4-d7a5-4e0f-abdb-232e184a6eca","treatment_state":"RESPONSE_RELEASED"},"result":"pass"},{"affected_by":[],"condition_id":"BR-RUA-013","evidence_refs":[{"artifact_path":"probe/journals/caller-journal.jsonl","artifact_sha256":"21d9ae742393fcac2e7f47925fb303a065125c7bcd0c2fbe5c8224bb2522ebe0","event_id":"234eb8a8-0c23-4a11-995f-baa3a806a59b"},{"artifact_path":"probe/journals/controller-journal.jsonl","artifact_sha256":"b12c4fd69de3344e66d5dc57aa0efa09cc0c034f3961bdf35eaff6a732b756c2","event_id":"0aac6fe4-d7a5-4e0f-abdb-232e184a6eca"},{"artifact_path":"probe/journals/provider-journal.jsonl","artifact_sha256":"f081060c9dbec365a49f506c61ff913429b50cc1e4c1d4767eaa04b3b1744300","event_id":"00d065fb-da90-4e9a-b057-808dba28fb6d"},{"artifact_path":"probe/journals/provider-journal.jsonl","artifact_sha256":"f081060c9dbec365a49f506c61ff913429b50cc1e4c1d4767eaa04b3b1744300","event_id":"9a4c48f1-7cc7-4b86-8a98-367af0d71669"}],"expected":{"conflict_count":0,"observation_caused_by_signal":true,"signal_attempt_id":"0d044e7d-5a06-41a1-baee-70a7e3e915c9","signal_causation_event_ids":["234eb8a8-0c23-4a11-995f-baa3a806a59b","9a4c48f1-7cc7-4b86-8a98-367af0d71669"]},"indeterminate_reasons":[],"observed":{"conflict_count":0,"observation_causation_event_ids":["0aac6fe4-d7a5-4e0f-abdb-232e184a6eca"],"observation_event_id":"00d065fb-da90-4e9a-b057-808dba28fb6d","signal_attempt_id":"0d044e7d-5a06-41a1-baee-70a7e3e915c9","signal_caller_timeout_event_id":"234eb8a8-0c23-4a11-995f-baa3a806a59b","signal_causation_event_ids":["234eb8a8-0c23-4a11-995f-baa3a806a59b","9a4c48f1-7cc7-4b86-8a98-367af0d71669"],"signal_event_id":"0aac6fe4-d7a5-4e0f-abdb-232e184a6eca","signal_provider_commit_event_id":"9a4c48f1-7cc7-4b86-8a98-367af0d71669"},"result":"pass"},{"affected_by":[],"condition_id":"BR-RUA-014","evidence_refs":[{"artifact_path":"probe/journals/provider-journal.jsonl","artifact_sha256":"f081060c9dbec365a49f506c61ff913429b50cc1e4c1d4767eaa04b3b1744300","event_id":"00d065fb-da90-4e9a-b057-808dba28fb6d"},{"artifact_path":"probe/journals/provider-journal.jsonl","artifact_sha256":"f081060c9dbec365a49f506c61ff913429b50cc1e4c1d4767eaa04b3b1744300","event_id":"5aae5616-e00c-454a-b9b5-4c1a23bef552"}],"expected":{"release_after_observation_in_same_instance":true,"release_caused_by_observation":true,"safety_release_count":0},"indeterminate_reasons":[],"observed":{"observation_event_id":"00d065fb-da90-4e9a-b057-808dba28fb6d","observation_source_sequence":5,"release_causation_event_ids":["00d065fb-da90-4e9a-b057-808dba28fb6d"],"release_event_id":"5aae5616-e00c-454a-b9b5-4c1a23bef552","release_source_sequence":6,"safety_release_count":0,"same_source_instance":true},"result":"pass"},{"affected_by":[],"condition_id":"BR-RUA-015","evidence_refs":[{"artifact_path":"probe/journals/caller-journal.jsonl","artifact_sha256":"21d9ae742393fcac2e7f47925fb303a065125c7bcd0c2fbe5c8224bb2522ebe0","event_id":"1b5ee81c-35b7-4ca0-817f-d338b68c601f"},{"artifact_path":"probe/journals/caller-journal.jsonl","artifact_sha256":"21d9ae742393fcac2e7f47925fb303a065125c7bcd0c2fbe5c8224bb2522ebe0","event_id":"eada4178-aef3-44ca-b2ec-3c3ec6d80905"}],"expected":{"caller_events_carrying_provider_transaction_id":[],"outcome":"TIMED_OUT","provider_transaction_id":"5c443991-52a0-409c-9744-0aef53221779"},"indeterminate_reasons":[],"observed":{"caller_events_carrying_provider_transaction_id":[],"late_transport_settlements":["aborted"],"outcome":"TIMED_OUT","targeted_attempt_id":"0d044e7d-5a06-41a1-baee-70a7e3e915c9"},"result":"pass"}],"evidence_integrity":"verified","evidence_refs":[{"artifact_path":"admission/execution-manifest.json","artifact_sha256":"a1fd75394f2597338ef92b3c3bd946ac15aeb4aa34f1557e1ed54505c0111a4c"},{"artifact_path":"probe/inputs/approved-decision.json","artifact_sha256":"ed9cdc3d2b51385a0a7bf22cb3d4451f65c8246faed2baf84b4ba4d8bd4ed61e"},{"artifact_path":"probe/inputs/payment.json","artifact_sha256":"18f12b6f93070e70fb9e12d069e2dd265c2404aff207f5a9d65278ac5c2e332d"},{"artifact_path":"probe/journals/caller-journal.jsonl","artifact_sha256":"21d9ae742393fcac2e7f47925fb303a065125c7bcd0c2fbe5c8224bb2522ebe0"},{"artifact_path":"probe/journals/caller-journal.jsonl","artifact_sha256":"21d9ae742393fcac2e7f47925fb303a065125c7bcd0c2fbe5c8224bb2522ebe0","event_id":"1b5ee81c-35b7-4ca0-817f-d338b68c601f"},{"artifact_path":"probe/journals/caller-journal.jsonl","artifact_sha256":"21d9ae742393fcac2e7f47925fb303a065125c7bcd0c2fbe5c8224bb2522ebe0","event_id":"234eb8a8-0c23-4a11-995f-baa3a806a59b"},{"artifact_path":"probe/journals/caller-journal.jsonl","artifact_sha256":"21d9ae742393fcac2e7f47925fb303a065125c7bcd0c2fbe5c8224bb2522ebe0","event_id":"ac8cc6bd-14ee-4c40-8581-111a0ef3fbb2"},{"artifact_path":"probe/journals/caller-journal.jsonl","artifact_sha256":"21d9ae742393fcac2e7f47925fb303a065125c7bcd0c2fbe5c8224bb2522ebe0","event_id":"eada4178-aef3-44ca-b2ec-3c3ec6d80905"},{"artifact_path":"probe/journals/controller-journal.jsonl","artifact_sha256":"b12c4fd69de3344e66d5dc57aa0efa09cc0c034f3961bdf35eaff6a732b756c2"},{"artifact_path":"probe/journals/controller-journal.jsonl","artifact_sha256":"b12c4fd69de3344e66d5dc57aa0efa09cc0c034f3961bdf35eaff6a732b756c2","event_id":"0aac6fe4-d7a5-4e0f-abdb-232e184a6eca"},{"artifact_path":"probe/journals/provider-journal.jsonl","artifact_sha256":"f081060c9dbec365a49f506c61ff913429b50cc1e4c1d4767eaa04b3b1744300"},{"artifact_path":"probe/journals/provider-journal.jsonl","artifact_sha256":"f081060c9dbec365a49f506c61ff913429b50cc1e4c1d4767eaa04b3b1744300","event_id":"00d065fb-da90-4e9a-b057-808dba28fb6d"},{"artifact_path":"probe/journals/provider-journal.jsonl","artifact_sha256":"f081060c9dbec365a49f506c61ff913429b50cc1e4c1d4767eaa04b3b1744300","event_id":"5aae5616-e00c-454a-b9b5-4c1a23bef552"},{"artifact_path":"probe/journals/provider-journal.jso